<?xml version="1.0" encoding="UTF-8"?>
<!--
To change this license header, choose License Headers in Project Properties.
To change this template file, choose Tools | Templates
and open the template in the editor.
-->


<moto-equip
    xmlns:xsi='http://www.w3.org/2001/XMLSchema-instance'
    xmlns='http://epam.by/motoequip'
    xsi:schemaLocation='http://epam.by/motoequip equip.xsd'>
    
    <helmet id="id1" name="520 CARBON" size="XL" genderStyle="M" helmetType="INTEGRAL">
        <manufacturer>ROCC</manufacturer>
        <price>300</price>
        <weight>1.210</weight>
        <baseMaterial>ABS</baseMaterial>
        <motoType>COMMON</motoType>
        <shellMaterial>Carbon</shellMaterial>
        <insertMaterial>HydraDry</insertMaterial>
        <vents>7</vents>
        <sunVisor>true</sunVisor>
        <headsetConnector>false</headsetConnector>
        <admissionGp>false</admissionGp>
    </helmet>
    <helmet id="id2" name="524 FIBERGLASS" size="XL" genderStyle="Y" helmetType="INTEGRAL">
        <manufacturer>ROCC</manufacturer>
        <price>170</price>
        <weight>1.450</weight>
        <baseMaterial>ABS</baseMaterial>
        <motoType>ENDURO</motoType>
        <shellMaterial>Fiberglass</shellMaterial>
        <insertMaterial>HydraDry</insertMaterial>
        <vents>5</vents>
        <sunVisor>true</sunVisor>
        <headsetConnector>false</headsetConnector>
        <admissionGp>false</admissionGp>
    </helmet>
    <helmet id="id3" name="482 COOL" size="XL" helmetType="INTEGRAL">
        <manufacturer>ROCC</manufacturer>
        <price>160</price>
        <weight>1.450</weight>
        <baseMaterial>ABS</baseMaterial>
        <motoType></motoType>
        <shellMaterial>ABS</shellMaterial>
        <insertMaterial>Silver Cool</insertMaterial>
        <vents>7</vents>
        <sunVisor>true</sunVisor>
        <headsetConnector>false</headsetConnector>
        <admissionGp>false</admissionGp>
    </helmet>
    <visor id="id4" name="sunVisor">
        <manufacturer>ROCC</manufacturer>
        <price>10</price>
        <weight>0.050</weight>
        <baseMaterial>ABS</baseMaterial>
        <forWhat>id2</forWhat>
        <forWhat>id3</forWhat>
        <antiblick>true</antiblick>
        <antifog>true</antifog>
        <pinlock>true</pinlock>
    </visor>

</moto-equip>
